text,cmp_code,eu_code,pos,manifesto_id,party,date,language,source,has_eu_code,is_primary_doc,may_contradict_core_dataset,md5sum_text,url_original,md5sum_original,annotations,handbook,is_copy_of,title,id,manifesto_id_section
nuevas formas innovadoras de organización laboral.,703,,497,33903_200803,33903,200803,spanish,MARPOR,True,True,False,bc405f6af7e66784dd35ea5eaddb0844,/down/originals/33903_2008.pdf,72c810bafbcabee1b9f29b0296004310,True,2.0,,Elecciones Generales 2008. Eusko Alkartasuna. Programa 1.6,33903_200803,33903_200803_25
"Apoyo a la Red Vasca de Ciencia, Tecnología e Innovación, donde se encuentran los centros tecnológicos, centros sectoriales, unidades de I+D empresariales, Universidades y otras entidades dedicadas a la investigación.",411,,498,33903_200803,33903,200803,spanish,MARPOR,True,True,False,bc405f6af7e66784dd35ea5eaddb0844,/down/originals/33903_2008.pdf,72c810bafbcabee1b9f29b0296004310,True,2.0,,Elecciones Generales 2008. Eusko Alkartasuna. Programa 1.6,33903_200803,33903_200803_25
"Defensa y apoyo de proyectos de investigación estratégica, especialmente los centros de investigación cooperativa que aglutinan a todos aquellos grupos de investigación, empresas y agentes que trabajan en una línea de investigación estratégica para generar masa crítica y poder ser un nodo en esas líneas en el espacio europeo de investigación.",411,,499,33903_200803,33903,200803,spanish,MARPOR,True,True,False,bc405f6af7e66784dd35ea5eaddb0844,/down/originals/33903_2008.pdf,72c810bafbcabee1b9f29b0296004310,True,2.0,,Elecciones Generales 2008. Eusko Alkartasuna. Programa 1.6,33903_200803,33903_200803_25
Promoción del Emprendizaje y la cultura emprendedora.,402,,500,33903_200803,33903,200803,spanish,MARPOR,True,True,False,bc405f6af7e66784dd35ea5eaddb0844,/down/originals/33903_2008.pdf,72c810bafbcabee1b9f29b0296004310,True,2.0,,Elecciones Generales 2008. Eusko Alkartasuna. Programa 1.6,33903_200803,33903_200803_25
Apoyo a la creación de empresas de base tecnológica y/o innovadora.,411,,501,33903_200803,33903,200803,spanish,MARPOR,True,True,False,bc405f6af7e66784dd35ea5eaddb0844,/down/originals/33903_2008.pdf,72c810bafbcabee1b9f29b0296004310,True,2.0,,Elecciones Generales 2008. Eusko Alkartasuna. Programa 1.6,33903_200803,33903_200803_26
"Desarrollo de nuevas formas de financiación en el proceso de creación empresarial,",402,,502,33903_200803,33903,200803,spanish,MARPOR,True,True,False,bc405f6af7e66784dd35ea5eaddb0844,/down/originals/33903_2008.pdf,72c810bafbcabee1b9f29b0296004310,True,2.0,,Elecciones Generales 2008. Eusko Alkartasuna. Programa 1.6,33903_200803,33903_200803_26
potenciando el capital-riesgo responsable y comprometido con el País.,402,,503,33903_200803,33903,200803,spanish,MARPOR,True,True,False,bc405f6af7e66784dd35ea5eaddb0844,/down/originals/33903_2008.pdf,72c810bafbcabee1b9f29b0296004310,True,2.0,,Elecciones Generales 2008. Eusko Alkartasuna. Programa 1.6,33903_200803,33903_200803_26
"Apoyo a estructuras que ayuden al desarrollo empresarial, /como Parques Tecnológicos y Polos de Innovación.",402,,504,33903_200803,33903,200803,spanish,MARPOR,True,True,False,bc405f6af7e66784dd35ea5eaddb0844,/down/originals/33903_2008.pdf,72c810bafbcabee1b9f29b0296004310,True,2.0,,Elecciones Generales 2008. Eusko Alkartasuna. Programa 1.6,33903_200803,33903_200803_26
Simplificación de los trámites burocráticos y administrativos en los procesos de creación y constitución de nuevas empresas.,402,,505,33903_200803,33903,200803,spanish,MARPOR,True,True,False,bc405f6af7e66784dd35ea5eaddb0844,/down/originals/33903_2008.pdf,72c810bafbcabee1b9f29b0296004310,True,2.0,,Elecciones Generales 2008. Eusko Alkartasuna. Programa 1.6,33903_200803,33903_200803_26
"Fomentar nuevas formas de gestión dirigidas a promover la participación de las personas en las empresas, fundamentalmente PYMES.",402,,506,33903_200803,33903,200803,spanish,MARPOR,True,True,False,bc405f6af7e66784dd35ea5eaddb0844,/down/originals/33903_2008.pdf,72c810bafbcabee1b9f29b0296004310,True,2.0,,Elecciones Generales 2008. Eusko Alkartasuna. Programa 1.6,33903_200803,33903_200803_26
"Apoyar los proyectos de internacionalización de nuestras empresas, tanto en implantación como en el lanzamiento de nuevos productos y servicios.",410,,507,33903_200803,33903,200803,spanish,MARPOR,True,True,False,bc405f6af7e66784dd35ea5eaddb0844,/down/originals/33903_2008.pdf,72c810bafbcabee1b9f29b0296004310,True,2.0,,Elecciones Generales 2008. Eusko Alkartasuna. Programa 1.6,33903_200803,33903_200803_26
En el ámbito de la Sociedad de la Información desde Eusko Alkartasuna defenderemos:,,,508,33903_200803,33903,200803,spanish,MARPOR,True,True,False,bc405f6af7e66784dd35ea5eaddb0844,/down/originals/33903_2008.pdf,72c810bafbcabee1b9f29b0296004310,True,2.0,,Elecciones Generales 2008. Eusko Alkartasuna. Programa 1.6,33903_200803,33903_200803_26
"Apoyo al desarrollo de estrategias dirigidas a la incorporación avanzada de las tecnologías de la Información y Comunicación en nuestras empresas, incidiendo especialmente en las PYMES y Micropymes, para la mejora de su competitividad.",403,,509,33903_200803,33903,200803,spanish,MARPOR,True,True,False,bc405f6af7e66784dd35ea5eaddb0844,/down/originals/33903_2008.pdf,72c810bafbcabee1b9f29b0296004310,True,2.0,,Elecciones Generales 2008. Eusko Alkartasuna. Programa 1.6,33903_200803,33903_200803_26
Desarrollar productos y servicios educativos basados en el uso intensivo de TICs para la mejora de los procesos de enseñanza y aprendizaje.,411,,510,33903_200803,33903,200803,spanish,MARPOR,True,True,False,bc405f6af7e66784dd35ea5eaddb0844,/down/originals/33903_2008.pdf,72c810bafbcabee1b9f29b0296004310,True,2.0,,Elecciones Generales 2008. Eusko Alkartasuna. Programa 1.6,33903_200803,33903_200803_26
Promover el nuevo rol de las Universidades en la sociedad del conocimiento a través de la incorporación de las TICs en la transmisión del conocimiento y coordinación con las estrategias locales y de País.,411,,511,33903_200803,33903,200803,spanish,MARPOR,True,True,False,bc405f6af7e66784dd35ea5eaddb0844,/down/originals/33903_2008.pdf,72c810bafbcabee1b9f29b0296004310,True,2.0,,Elecciones Generales 2008. Eusko Alkartasuna. Programa 1.6,33903_200803,33903_200803_26
Conseguir en Euskalherria una Sociedad de la Información verdaderamente inclusiva para todas las personas.,411,,512,33903_200803,33903,200803,spanish,MARPOR,True,True,False,bc405f6af7e66784dd35ea5eaddb0844,/down/originals/33903_2008.pdf,72c810bafbcabee1b9f29b0296004310,True,2.0,,Elecciones Generales 2008. Eusko Alkartasuna. Programa 1.6,33903_200803,33903_200803_26
Como oportunidad para ayudar al logro de la cohesión social y el fomento de la calidad de vida.,606,,513,33903_200803,33903,200803,spanish,MARPOR,True,True,False,bc405f6af7e66784dd35ea5eaddb0844,/down/originals/33903_2008.pdf,72c810bafbcabee1b9f29b0296004310,True,2.0,,Elecciones Generales 2008. Eusko Alkartasuna. Programa 1.6,33903_200803,33903_200803_26
Como medio para que ninguna persona con discapacidad u otras necesidades especiales quede fuera de los beneficios de la Sociedad de la Información.,411,,514,33903_200803,33903,200803,spanish,MARPOR,True,True,False,bc405f6af7e66784dd35ea5eaddb0844,/down/originals/33903_2008.pdf,72c810bafbcabee1b9f29b0296004310,True,2.0,,Elecciones Generales 2008. Eusko Alkartasuna. Programa 1.6,33903_200803,33903_200803_26
"Eliminar los desfases que se producen en el acceso a las nuevas tecnologías en función del género, nivel de instrucción, o de renta.",411,,515,33903_200803,33903,200803,spanish,MARPOR,True,True,False,bc405f6af7e66784dd35ea5eaddb0844,/down/originals/33903_2008.pdf,72c810bafbcabee1b9f29b0296004310,True,2.0,,Elecciones Generales 2008. Eusko Alkartasuna. Programa 1.6,33903_200803,33903_200803_26
"Por ello lucharemos por una sociedad donde todas las personas tengan un acceso fácil, equitativo y accesible al potencial creativo de las tecnologías de la información y comunicación, con el objeto de mejorar sus vidas y avanzar en una sociedad mas igualitaria y democrática, donde la sociedad de la información sea un factor de progreso y cohesión social con una visión más justa y solidaria para el desarrollo económico y social.",411,,516,33903_200803,33903,200803,spanish,MARPOR,True,True,False,bc405f6af7e66784dd35ea5eaddb0844,/down/originals/33903_2008.pdf,72c810bafbcabee1b9f29b0296004310,True,2.0,,Elecciones Generales 2008. Eusko Alkartasuna. Programa 1.6,33903_200803,33903_200803_26
"Eusko Alkartasuna ha denunciado, denuncia y denunciará el incumplimiento sistemático del pacto estatutario.",301,,517,33903_200803,33903,200803,spanish,MARPOR,True,True,False,bc405f6af7e66784dd35ea5eaddb0844,/down/originals/33903_2008.pdf,72c810bafbcabee1b9f29b0296004310,True,2.0,,Elecciones Generales 2008. Eusko Alkartasuna. Programa 1.6,33903_200803,33903_200803_26
En esta materia igualmente se ha incumplido el Estatuto al no ser transferido los bienes y servicios para ejercer nuestra competencia en el ámbito de la investigación científica y la promoción económica.,301,,518,33903_200803,33903,200803,spanish,MARPOR,True,True,False,bc405f6af7e66784dd35ea5eaddb0844,/down/originals/33903_2008.pdf,72c810bafbcabee1b9f29b0296004310,True,2.0,,Elecciones Generales 2008. Eusko Alkartasuna. Programa 1.6,33903_200803,33903_200803_26
Sólo en los últimos años este incumplimiento ha supuesto para la Comunidad Autónoma del País Vasco un déficit de 1000 millones de euros entre lo que aportamos vía cupo para la investigación y lo que retorna del Estado para ello.,301,,519,33903_200803,33903,200803,spanish,MARPOR,True,True,False,bc405f6af7e66784dd35ea5eaddb0844,/down/originals/33903_2008.pdf,72c810bafbcabee1b9f29b0296004310,True,2.0,,Elecciones Generales 2008. Eusko Alkartasuna. Programa 1.6,33903_200803,33903_200803_26
Eusko Alkartasuna reivindicará la transferencia en esta materia de vital importancia para el desarrollo y futuro de nuestro País.,301,,520,33903_200803,33903,200803,spanish,MARPOR,True,True,False,bc405f6af7e66784dd35ea5eaddb0844,/down/originals/33903_2008.pdf,72c810bafbcabee1b9f29b0296004310,True,2.0,,Elecciones Generales 2008. Eusko Alkartasuna. Programa 1.6,33903_200803,33903_200803_26
"Igualmente, defenderá una política fiscal que fomente la innovación y la investigación como compromiso de desarrollo de nuestro País y beneficio de la sociedad.",411,,521,33903_200803,33903,200803,spanish,MARPOR,True,True,False,bc405f6af7e66784dd35ea5eaddb0844,/down/originals/33903_2008.pdf,72c810bafbcabee1b9f29b0296004310,True,2.0,,Elecciones Generales 2008. Eusko Alkartasuna. Programa 1.6,33903_200803,33903_200803_27
3.2.3 POLÍTICA FISCAL Y FINANCIERA,,,522,33903_200803,33903,200803,spanish,MARPOR,True,True,False,bc405f6af7e66784dd35ea5eaddb0844,/down/originals/33903_2008.pdf,72c810bafbcabee1b9f29b0296004310,True,2.0,,Elecciones Generales 2008. Eusko Alkartasuna. Programa 1.6,33903_200803,33903_200803_27
"En esta materia, poco podemos aportar desde la perspectiva de la CAV salvo exigir el respeto que, de acuerdo con las determinaciones constitucionales y con el marco estatutario vigente, corresponde la soberanía fiscal de la CAV y de Navarra por parte del Estado",301,,523,33903_200803,33903,200803,spanish,MARPOR,True,True,False,bc405f6af7e66784dd35ea5eaddb0844,/down/originals/33903_2008.pdf,72c810bafbcabee1b9f29b0296004310,True,2.0,,Elecciones Generales 2008. Eusko Alkartasuna. Programa 1.6,33903_200803,33903_200803_27
y la propia Unión Europea.,301,110.0,524,33903_200803,33903,200803,spanish,MARPOR,True,True,False,bc405f6af7e66784dd35ea5eaddb0844,/down/originals/33903_2008.pdf,72c810bafbcabee1b9f29b0296004310,True,2.0,,Elecciones Generales 2008. Eusko Alkartasuna. Programa 1.6,33903_200803,33903_200803_27
"Resulta hiriente que, enarbolando un pretendido fervor constitucionalista  y un aparente respeto del Estatuto de Gernika, las fuerzas del Estado han ido reelaborando su contenido, tratando de convertir un derecho vinculado a un pacto entre Euskadi y España en una  generosa liberalidad que puede ser requerida para su devolución cuando al Estado interese.",602,,525,33903_200803,33903,200803,spanish,MARPOR,True,True,False,bc405f6af7e66784dd35ea5eaddb0844,/down/originals/33903_2008.pdf,72c810bafbcabee1b9f29b0296004310,True,2.0,,Elecciones Generales 2008. Eusko Alkartasuna. Programa 1.6,33903_200803,33903_200803_27
"Una visión que ha sido traslada a las instituciones europeas, interesadas en mantener la preeminencia de los Estados y,",301,110.0,526,33903_200803,33903,200803,spanish,MARPOR,True,True,False,bc405f6af7e66784dd35ea5eaddb0844,/down/originals/33903_2008.pdf,72c810bafbcabee1b9f29b0296004310,True,2.0,,Elecciones Generales 2008. Eusko Alkartasuna. Programa 1.6,33903_200803,33903_200803_27
"por tanto, determinando que sólo éstos tienen capacidad normativa plena en materia fiscal.",202,108.0,527,33903_200803,33903,200803,spanish,MARPOR,True,True,False,bc405f6af7e66784dd35ea5eaddb0844,/down/originals/33903_2008.pdf,72c810bafbcabee1b9f29b0296004310,True,2.0,,Elecciones Generales 2008. Eusko Alkartasuna. Programa 1.6,33903_200803,33903_200803_27
"Por ello, exigimos el reconocimiento y respeto que corresponde a nuestra soberanía fiscal y, consecuentemente, nuestra presencia en rango de igualdad en los ámbitos de decisión europeos en materia fiscal.",301,,528,33903_200803,33903,200803,spanish,MARPOR,True,True,False,bc405f6af7e66784dd35ea5eaddb0844,/down/originals/33903_2008.pdf,72c810bafbcabee1b9f29b0296004310,True,2.0,,Elecciones Generales 2008. Eusko Alkartasuna. Programa 1.6,33903_200803,33903_200803_27
"Y, por supuesto, consideramos lamentable que a día de hoy todavía queden pendientes de transferir instrumentos económicos como crédito y banca,",301,,529,33903_200803,33903,200803,spanish,MARPOR,True,True,False,bc405f6af7e66784dd35ea5eaddb0844,/down/originals/33903_2008.pdf,72c810bafbcabee1b9f29b0296004310,True,2.0,,Elecciones Generales 2008. Eusko Alkartasuna. Programa 1.6,33903_200803,33903_200803_27
"seguros,",301,,530,33903_200803,33903,200803,spanish,MARPOR,True,True,False,bc405f6af7e66784dd35ea5eaddb0844,/down/originals/33903_2008.pdf,72c810bafbcabee1b9f29b0296004310,True,2.0,,Elecciones Generales 2008. Eusko Alkartasuna. Programa 1.6,33903_200803,33903_200803_27
crédito oficial y,301,,531,33903_200803,33903,200803,spanish,MARPOR,True,True,False,bc405f6af7e66784dd35ea5eaddb0844,/down/originals/33903_2008.pdf,72c810bafbcabee1b9f29b0296004310,True,2.0,,Elecciones Generales 2008. Eusko Alkartasuna. Programa 1.6,33903_200803,33903_200803_27
mercado de valores.,301,,532,33903_200803,33903,200803,spanish,MARPOR,True,True,False,bc405f6af7e66784dd35ea5eaddb0844,/down/originals/33903_2008.pdf,72c810bafbcabee1b9f29b0296004310,True,2.0,,Elecciones Generales 2008. Eusko Alkartasuna. Programa 1.6,33903_200803,33903_200803_27
Poco puede añadirse a lo que ya se ha señalado a lo largo de este programa electoral en materia de transferencias.,301,,533,33903_200803,33903,200803,spanish,MARPOR,True,True,False,bc405f6af7e66784dd35ea5eaddb0844,/down/originals/33903_2008.pdf,72c810bafbcabee1b9f29b0296004310,True,2.0,,Elecciones Generales 2008. Eusko Alkartasuna. Programa 1.6,33903_200803,33903_200803_27
"No obstante, y desde la visión progresista y socialdemócrata  que caracteriza a Eusko Alkartasuna, aportaremos en nuestra labor institucional en las Cortes una serie de propuestas que encajan con lo que venimos propugnando en las instituciones fiscalmente soberanas de la CAV y de Navarra.",301,,534,33903_200803,33903,200803,spanish,MARPOR,True,True,False,bc405f6af7e66784dd35ea5eaddb0844,/down/originals/33903_2008.pdf,72c810bafbcabee1b9f29b0296004310,True,2.0,,Elecciones Generales 2008. Eusko Alkartasuna. Programa 1.6,33903_200803,33903_200803_27
"Así, apostamos por una acción en materia fiscal y financiera al servicio de la lucha contra la fractura social y consecuentemente con ello, abogamos por la reconsideración de la tendencia generalizada en toda la Unión Europea de un incremento progresivo de la imposición indirecta frente a la directa.",503,,535,33903_200803,33903,200803,spanish,MARPOR,True,True,False,bc405f6af7e66784dd35ea5eaddb0844,/down/originals/33903_2008.pdf,72c810bafbcabee1b9f29b0296004310,True,2.0,,Elecciones Generales 2008. Eusko Alkartasuna. Programa 1.6,33903_200803,33903_200803_27
"Igualmente,  la incorporación del concepto de fiscalidad verde al sistema impositivo español constituye  una apuesta firme de Eusko Alkartasuna por el desarrollo sostenible entendido en su verdadera dimensión,",416,,536,33903_200803,33903,200803,spanish,MARPOR,True,True,False,bc405f6af7e66784dd35ea5eaddb0844,/down/originals/33903_2008.pdf,72c810bafbcabee1b9f29b0296004310,True,2.0,,Elecciones Generales 2008. Eusko Alkartasuna. Programa 1.6,33903_200803,33903_200803_27
"pues es precisamente aquí, en el sistema fiscal, donde los conceptos de economía, sociedad y medio ambiente confluyen en un mismo plano de políticas públicas  y donde puede quedar definido el verdadero carácter progresista de los agentes institucionales.",503,,537,33903_200803,33903,200803,spanish,MARPOR,True,True,False,bc405f6af7e66784dd35ea5eaddb0844,/down/originals/33903_2008.pdf,72c810bafbcabee1b9f29b0296004310,True,2.0,,Elecciones Generales 2008. Eusko Alkartasuna. Programa 1.6,33903_200803,33903_200803_27
3.2.4 TRANSPORTE E INFRAESTRUCTURAS VINCULADAS,,,538,33903_200803,33903,200803,spanish,MARPOR,True,True,False,bc405f6af7e66784dd35ea5eaddb0844,/down/originals/33903_2008.pdf,72c810bafbcabee1b9f29b0296004310,True,2.0,,Elecciones Generales 2008. Eusko Alkartasuna. Programa 1.6,33903_200803,33903_200803_27
"Ante la previsión de los expertos de que entre 2000 y 2010 la demanda de transporte interno en la Comunidad Europea crecerá un 40 por ciento, la Unión Europea elaboró el Libro Blanco del Transporte con objeto de diseñar las soluciones que eviten los dramáticos efectos que sobre el Medio Ambiente y la salud puede generar tal incremento del transporte  intracomunitario así como el colapso que puede suponer para sus infraestructuras viarias.",411,,539,33903_200803,33903,200803,spanish,MARPOR,True,True,False,bc405f6af7e66784dd35ea5eaddb0844,/down/originals/33903_2008.pdf,72c810bafbcabee1b9f29b0296004310,True,2.0,,Elecciones Generales 2008. Eusko Alkartasuna. Programa 1.6,33903_200803,33903_200803_27
Se hacía necesario encontrar modos de transporte alternativos y soluciones logísticas con mayor capacidad de crecimiento que posibilitasen un desarrollo sostenible.,411,,540,33903_200803,33903,200803,spanish,MARPOR,True,True,False,bc405f6af7e66784dd35ea5eaddb0844,/down/originals/33903_2008.pdf,72c810bafbcabee1b9f29b0296004310,True,2.0,,Elecciones Generales 2008. Eusko Alkartasuna. Programa 1.6,33903_200803,33903_200803_27
"El Libro Blanco del Transporte de la Unión Europea pretende establecer las estrategias viables que rompan la relación entre el crecimiento económico y el de la movilidad, con los objetivos generales de reequilibrar los distintos modos de transporte,",411,,541,33903_200803,33903,200803,spanish,MARPOR,True,True,False,bc405f6af7e66784dd35ea5eaddb0844,/down/originals/33903_2008.pdf,72c810bafbcabee1b9f29b0296004310,True,2.0,,Elecciones Generales 2008. Eusko Alkartasuna. Programa 1.6,33903_200803,33903_200803_28
suprimir los puntos de estrangulamiento y,411,,542,33903_200803,33903,200803,spanish,MARPOR,True,True,False,bc405f6af7e66784dd35ea5eaddb0844,/down/originals/33903_2008.pdf,72c810bafbcabee1b9f29b0296004310,True,2.0,,Elecciones Generales 2008. Eusko Alkartasuna. Programa 1.6,33903_200803,33903_200803_28
gestionar la globalización del transporte.,411,,543,33903_200803,33903,200803,spanish,MARPOR,True,True,False,bc405f6af7e66784dd35ea5eaddb0844,/down/originals/33903_2008.pdf,72c810bafbcabee1b9f29b0296004310,True,2.0,,Elecciones Generales 2008. Eusko Alkartasuna. Programa 1.6,33903_200803,33903_200803_28
"Para conseguir dichos objetivos, se desarrollan 60 propuestas.",411,,544,33903_200803,33903,200803,spanish,MARPOR,True,True,False,bc405f6af7e66784dd35ea5eaddb0844,/down/originals/33903_2008.pdf,72c810bafbcabee1b9f29b0296004310,True,2.0,,Elecciones Generales 2008. Eusko Alkartasuna. Programa 1.6,33903_200803,33903_200803_28
"De ellas, las más significativas que se refieren al transporte de mercancías son:",,,545,33903_200803,33903,200803,spanish,MARPOR,True,True,False,bc405f6af7e66784dd35ea5eaddb0844,/down/originals/33903_2008.pdf,72c810bafbcabee1b9f29b0296004310,True,2.0,,Elecciones Generales 2008. Eusko Alkartasuna. Programa 1.6,33903_200803,33903_200803_28
Revitalizar el ferrocarril,411,,546,33903_200803,33903,200803,spanish,MARPOR,True,True,False,bc405f6af7e66784dd35ea5eaddb0844,/down/originals/33903_2008.pdf,72c810bafbcabee1b9f29b0296004310,True,2.0,,Elecciones Generales 2008. Eusko Alkartasuna. Programa 1.6,33903_200803,33903_200803_28
Fomentar el transporte marítimo y fluvial,411,,547,33903_200803,33903,200803,spanish,MARPOR,True,True,False,bc405f6af7e66784dd35ea5eaddb0844,/down/originals/33903_2008.pdf,72c810bafbcabee1b9f29b0296004310,True,2.0,,Elecciones Generales 2008. Eusko Alkartasuna. Programa 1.6,33903_200803,33903_200803_28
Materializar la intermodalidad.,411,,548,33903_200803,33903,200803,spanish,MARPOR,True,True,False,bc405f6af7e66784dd35ea5eaddb0844,/down/originals/33903_2008.pdf,72c810bafbcabee1b9f29b0296004310,True,2.0,,Elecciones Generales 2008. Eusko Alkartasuna. Programa 1.6,33903_200803,33903_200803_28
"En la misma línea, el Consejo de Ministros de Transportes de la UE de 31 de mayo y 1 y 2 de junio de 2002 señalaba su apuesta por el transporte marítimo de corta distancia como opción fundamental para aliviar el crecimiento del tráfico por carretera y contribuir a la reducción de la congestión, los accidentes, el ruido y la contaminación del aire que ésta supone.",411,,549,33903_200803,33903,200803,spanish,MARPOR,True,True,False,bc405f6af7e66784dd35ea5eaddb0844,/down/originals/33903_2008.pdf,72c810bafbcabee1b9f29b0296004310,True,2.0,,Elecciones Generales 2008. Eusko Alkartasuna. Programa 1.6,33903_200803,33903_200803_28
Para ello señala la necesidad y el compromiso de promover la la intermodalidad marítimo-ferroviaria.,411,,550,33903_200803,33903,200803,spanish,MARPOR,True,True,False,bc405f6af7e66784dd35ea5eaddb0844,/down/originals/33903_2008.pdf,72c810bafbcabee1b9f29b0296004310,True,2.0,,Elecciones Generales 2008. Eusko Alkartasuna. Programa 1.6,33903_200803,33903_200803_28
"No ha de olvidarse que, dentro del ámbito de la Europa Comunitaria, en la última década del siglo XX el transporte marítimo de corta distancia fue el único modo de transporte capaz de mantenerse al nivel del crecimiento rápido del transporte por carretera, aumentando ambos por encima del 25%.",411,,551,33903_200803,33903,200803,spanish,MARPOR,True,True,False,bc405f6af7e66784dd35ea5eaddb0844,/down/originals/33903_2008.pdf,72c810bafbcabee1b9f29b0296004310,True,2.0,,Elecciones Generales 2008. Eusko Alkartasuna. Programa 1.6,33903_200803,33903_200803_28
"En 2001 el transporte marítimo de corta distancia representó el 40% de todas las toneladas-kilómetro de Europa, mientras que la cuota del transporte por carretera fue del 45.",411,,552,33903_200803,33903,200803,spanish,MARPOR,True,True,False,bc405f6af7e66784dd35ea5eaddb0844,/down/originals/33903_2008.pdf,72c810bafbcabee1b9f29b0296004310,True,2.0,,Elecciones Generales 2008. Eusko Alkartasuna. Programa 1.6,33903_200803,33903_200803_28
"Esta realidad se complica en el caso de los puertos vascos al encontrarnos que el régimen competencial reserva la titularidad de Pasajes y Bilbao dentro de la Sociedad de Puertos del Estado, sin que se hayan articulado mecanismos suficientes de coordinación con las redes de transporte ferroviario, donde encontramos titularidades y características técnicas diversas que dificultan una adecuada intermodalidad puerto-ferrocarril.",411,,553,33903_200803,33903,200803,spanish,MARPOR,True,True,False,bc405f6af7e66784dd35ea5eaddb0844,/down/originals/33903_2008.pdf,72c810bafbcabee1b9f29b0296004310,True,2.0,,Elecciones Generales 2008. Eusko Alkartasuna. Programa 1.6,33903_200803,33903_200803_28
"Así pues, esta visión de escala europea se hace especialmente adecuada al observar la problemática del Estado español y más en concreto en los casos de la CAV y de Nafarroa.",411,,554,33903_200803,33903,200803,spanish,MARPOR,True,True,False,bc405f6af7e66784dd35ea5eaddb0844,/down/originals/33903_2008.pdf,72c810bafbcabee1b9f29b0296004310,True,2.0,,Elecciones Generales 2008. Eusko Alkartasuna. Programa 1.6,33903_200803,33903_200803_28
"Además, hay que añadir aquí la debilidad del transporte público frente a los medios de locomoción privados, cuyo peso porcentual en el transporte de viajeros ha ido incrementándose en las últimas décadas, aumentando un problema ya por sí de difícil solución.",411,,555,33903_200803,33903,200803,spanish,MARPOR,True,True,False,bc405f6af7e66784dd35ea5eaddb0844,/down/originals/33903_2008.pdf,72c810bafbcabee1b9f29b0296004310,True,2.0,,Elecciones Generales 2008. Eusko Alkartasuna. Programa 1.6,33903_200803,33903_200803_28
"Más aún ante un modelo urbanístico generalizado en el que se ha potenciado la salida de los núcleos urbanos de los espacios destinados a actividades económicas, tanto productivas como terciarias, de manera que se incrementan exponencialmente los desplazamientos en la vida cotidiana de nuestra ciudadanía, desplazamientos que siguiendo la tónica general se caracterizan por ser eminentemente de carácter privado.",411,,556,33903_200803,33903,200803,spanish,MARPOR,True,True,False,bc405f6af7e66784dd35ea5eaddb0844,/down/originals/33903_2008.pdf,72c810bafbcabee1b9f29b0296004310,True,2.0,,Elecciones Generales 2008. Eusko Alkartasuna. Programa 1.6,33903_200803,33903_200803_28
