text,cmp_code,eu_code,pos,manifesto_id,party,date,language,source,has_eu_code,is_primary_doc,may_contradict_core_dataset,md5sum_text,url_original,md5sum_original,annotations,handbook,is_copy_of,title,id,manifesto_id_section
Tax incentives are creating a cleaner lorry fleet while the road haulage industry will benefit from steep reductions in Vehicle Excise Duty to among the lowest in Europe.,402,,413,51320_200106,51320,200106,english,MARPOR,False,True,False,8a16cb00ecf05f0ec40a7aa0ad337148,/down/originals/2021-1/51320_2001.pdf,deb3ffa297973eaac15e526fb33b34bf,True,,,Ambitions for Britain,51320_200106,51320_200106_21
We will also ensure that hauliers from overseas pay their fair share towards the cost of our roads.,411,,414,51320_200106,51320,200106,english,MARPOR,False,True,False,8a16cb00ecf05f0ec40a7aa0ad337148,/down/originals/2021-1/51320_2001.pdf,deb3ffa297973eaac15e526fb33b34bf,True,,,Ambitions for Britain,51320_200106,51320_200106_21
Smarter driving will be encouraged by new highway communications technology.,411,,415,51320_200106,51320,200106,english,MARPOR,False,True,False,8a16cb00ecf05f0ec40a7aa0ad337148,/down/originals/2021-1/51320_2001.pdf,deb3ffa297973eaac15e526fb33b34bf,True,,,Ambitions for Britain,51320_200106,51320_200106_21
"We are also working with the motor industry on safer, more fuel-efficient vehicles.",411,,416,51320_200106,51320,200106,english,MARPOR,False,True,False,8a16cb00ecf05f0ec40a7aa0ad337148,/down/originals/2021-1/51320_2001.pdf,deb3ffa297973eaac15e526fb33b34bf,True,,,Ambitions for Britain,51320_200106,51320_200106_21
• Buses: are vital to local journeys.,000,,417,51320_200106,51320,200106,english,MARPOR,False,True,False,8a16cb00ecf05f0ec40a7aa0ad337148,/down/originals/2021-1/51320_2001.pdf,deb3ffa297973eaac15e526fb33b34bf,True,,,Ambitions for Britain,51320_200106,51320_200106_21
"With Labour, 25,000 new buses are already in operation.",305,,418,51320_200106,51320,200106,english,MARPOR,False,True,False,8a16cb00ecf05f0ec40a7aa0ad337148,/down/originals/2021-1/51320_2001.pdf,deb3ffa297973eaac15e526fb33b34bf,True,,,Ambitions for Britain,51320_200106,51320_200106_21
"By 2006, almost the whole national bus fleet will be renewed.",411,,419,51320_200106,51320,200106,english,MARPOR,False,True,False,8a16cb00ecf05f0ec40a7aa0ad337148,/down/originals/2021-1/51320_2001.pdf,deb3ffa297973eaac15e526fb33b34bf,True,,,Ambitions for Britain,51320_200106,51320_200106_21
Lower concessionary fares have been introduced for over five million older and disabled travellers.,706,,420,51320_200106,51320,200106,english,MARPOR,False,True,False,8a16cb00ecf05f0ec40a7aa0ad337148,/down/originals/2021-1/51320_2001.pdf,deb3ffa297973eaac15e526fb33b34bf,True,,,Ambitions for Britain,51320_200106,51320_200106_21
"Park and ride schemes are increasing, and over 100 towns now have bus services linked to train stations, with cut-price fares.",411,,421,51320_200106,51320,200106,english,MARPOR,False,True,False,8a16cb00ecf05f0ec40a7aa0ad337148,/down/originals/2021-1/51320_2001.pdf,deb3ffa297973eaac15e526fb33b34bf,True,,,Ambitions for Britain,51320_200106,51320_200106_22
Bus partnerships between local authorities and private bus companies will improve passenger numbers and service quality.,411,,422,51320_200106,51320,200106,english,MARPOR,False,True,False,8a16cb00ecf05f0ec40a7aa0ad337148,/down/originals/2021-1/51320_2001.pdf,deb3ffa297973eaac15e526fb33b34bf,True,,,Ambitions for Britain,51320_200106,51320_200106_22
Nationally we will work to improve inter-city coach services.,411,,423,51320_200106,51320,200106,english,MARPOR,False,True,False,8a16cb00ecf05f0ec40a7aa0ad337148,/down/originals/2021-1/51320_2001.pdf,deb3ffa297973eaac15e526fb33b34bf,True,,,Ambitions for Britain,51320_200106,51320_200106_22
Integrated transport,,,424,51320_200106,51320,200106,english,MARPOR,False,True,False,8a16cb00ecf05f0ec40a7aa0ad337148,/down/originals/2021-1/51320_2001.pdf,deb3ffa297973eaac15e526fb33b34bf,True,,,Ambitions for Britain,51320_200106,51320_200106_22
Good transport systems offer choice across transport modes.,411,,425,51320_200106,51320,200106,english,MARPOR,False,True,False,8a16cb00ecf05f0ec40a7aa0ad337148,/down/originals/2021-1/51320_2001.pdf,deb3ffa297973eaac15e526fb33b34bf,True,,,Ambitions for Britain,51320_200106,51320_200106_22
Transport Direct – a phone and internet system designed to plan journeys and sell tickets – will put transport services at people’s fingertips.,411,,426,51320_200106,51320,200106,english,MARPOR,False,True,False,8a16cb00ecf05f0ec40a7aa0ad337148,/down/originals/2021-1/51320_2001.pdf,deb3ffa297973eaac15e526fb33b34bf,True,,,Ambitions for Britain,51320_200106,51320_200106_22
Walking and cycling will be encouraged in thousands of local transport schemes.,411,,427,51320_200106,51320,200106,english,MARPOR,False,True,False,8a16cb00ecf05f0ec40a7aa0ad337148,/down/originals/2021-1/51320_2001.pdf,deb3ffa297973eaac15e526fb33b34bf,True,,,Ambitions for Britain,51320_200106,51320_200106_22
Inland waterways are being revitalised and we will take forward the recommendations of the enquiry into the Marchioness disaster.,411,,428,51320_200106,51320,200106,english,MARPOR,False,True,False,8a16cb00ecf05f0ec40a7aa0ad337148,/down/originals/2021-1/51320_2001.pdf,deb3ffa297973eaac15e526fb33b34bf,True,,,Ambitions for Britain,51320_200106,51320_200106_22
International links are also vital.,107,,429,51320_200106,51320,200106,english,MARPOR,False,True,False,8a16cb00ecf05f0ec40a7aa0ad337148,/down/originals/2021-1/51320_2001.pdf,deb3ffa297973eaac15e526fb33b34bf,True,,,Ambitions for Britain,51320_200106,51320_200106_22
Plans for aviation and airports over the next 30 years will be produced next year.,411,,430,51320_200106,51320,200106,english,MARPOR,False,True,False,8a16cb00ecf05f0ec40a7aa0ad337148,/down/originals/2021-1/51320_2001.pdf,deb3ffa297973eaac15e526fb33b34bf,True,,,Ambitions for Britain,51320_200106,51320_200106_22
Merchant ships are returning to the British flag.,411,,431,51320_200106,51320,200106,english,MARPOR,False,True,False,8a16cb00ecf05f0ec40a7aa0ad337148,/down/originals/2021-1/51320_2001.pdf,deb3ffa297973eaac15e526fb33b34bf,True,,,Ambitions for Britain,51320_200106,51320_200106_22
We will complete the high-speed Channel Tunnel Rail Link.,411,,432,51320_200106,51320,200106,english,MARPOR,False,True,False,8a16cb00ecf05f0ec40a7aa0ad337148,/down/originals/2021-1/51320_2001.pdf,deb3ffa297973eaac15e526fb33b34bf,True,,,Ambitions for Britain,51320_200106,51320_200106_22
"Major national infrastructure projects, such as Heathrow Terminal 5, raise vital issues.",411,,433,51320_200106,51320,200106,english,MARPOR,False,True,False,8a16cb00ecf05f0ec40a7aa0ad337148,/down/originals/2021-1/51320_2001.pdf,deb3ffa297973eaac15e526fb33b34bf,True,,,Ambitions for Britain,51320_200106,51320_200106_22
We will continue to modernise the planning system and introduce new fast-track procedures for major projects of national significance.,411,,434,51320_200106,51320,200106,english,MARPOR,False,True,False,8a16cb00ecf05f0ec40a7aa0ad337148,/down/originals/2021-1/51320_2001.pdf,deb3ffa297973eaac15e526fb33b34bf,True,,,Ambitions for Britain,51320_200106,51320_200106_22
The Post Office and postal services,,,435,51320_200106,51320,200106,english,MARPOR,False,True,False,8a16cb00ecf05f0ec40a7aa0ad337148,/down/originals/2021-1/51320_2001.pdf,deb3ffa297973eaac15e526fb33b34bf,True,,,Ambitions for Britain,51320_200106,51320_200106_22
"We are committed to high-quality, universal postal services, and a dynamic Post Office which can thrive in a world of technological change and increased competitive pressure.",414,,436,51320_200106,51320,200106,english,MARPOR,False,True,False,8a16cb00ecf05f0ec40a7aa0ad337148,/down/originals/2021-1/51320_2001.pdf,deb3ffa297973eaac15e526fb33b34bf,True,,,Ambitions for Britain,51320_200106,51320_200106_22
Labour is working with the banks to offer a new universal banking service.,414,,437,51320_200106,51320,200106,english,MARPOR,False,True,False,8a16cb00ecf05f0ec40a7aa0ad337148,/down/originals/2021-1/51320_2001.pdf,deb3ffa297973eaac15e526fb33b34bf,True,,,Ambitions for Britain,51320_200106,51320_200106_22
"This will allow all benefit and pension recipients to receive their payments, at no charge, in full at the post office after the switch to Automated Credit Transfer in 2003.",706,,438,51320_200106,51320,200106,english,MARPOR,False,True,False,8a16cb00ecf05f0ec40a7aa0ad337148,/down/originals/2021-1/51320_2001.pdf,deb3ffa297973eaac15e526fb33b34bf,True,,,Ambitions for Britain,51320_200106,51320_200106_22
We also intend the local post office to become an invaluable resource for access to government information.,414,,439,51320_200106,51320,200106,english,MARPOR,False,True,False,8a16cb00ecf05f0ec40a7aa0ad337148,/down/originals/2021-1/51320_2001.pdf,deb3ffa297973eaac15e526fb33b34bf,True,,,Ambitions for Britain,51320_200106,51320_200106_22
There will be increased incentives for people to take over and modernise post offices.,414,,440,51320_200106,51320,200106,english,MARPOR,False,True,False,8a16cb00ecf05f0ec40a7aa0ad337148,/down/originals/2021-1/51320_2001.pdf,deb3ffa297973eaac15e526fb33b34bf,True,,,Ambitions for Britain,51320_200106,51320_200106_22
"Business customers, representing by far the majority of the Post Office’s turnover, want a full range of express, parcels and logistics services.",414,,441,51320_200106,51320,200106,english,MARPOR,False,True,False,8a16cb00ecf05f0ec40a7aa0ad337148,/down/originals/2021-1/51320_2001.pdf,deb3ffa297973eaac15e526fb33b34bf,True,,,Ambitions for Britain,51320_200106,51320_200106_23
We have given the Post Office greater commercial freedom in the public sector.,414,,442,51320_200106,51320,200106,english,MARPOR,False,True,False,8a16cb00ecf05f0ec40a7aa0ad337148,/down/originals/2021-1/51320_2001.pdf,deb3ffa297973eaac15e526fb33b34bf,True,,,Ambitions for Britain,51320_200106,51320_200106_23
It needs to be able to gain an advantage in the new postal market and become a leading force in domestic and international postal services through alliances and joint ventures.,414,,443,51320_200106,51320,200106,english,MARPOR,False,True,False,8a16cb00ecf05f0ec40a7aa0ad337148,/down/originals/2021-1/51320_2001.pdf,deb3ffa297973eaac15e526fb33b34bf,True,,,Ambitions for Britain,51320_200106,51320_200106_23
We want to help the Post Office keep up with the best in a fast-changing market.,414,,444,51320_200106,51320,200106,english,MARPOR,False,True,False,8a16cb00ecf05f0ec40a7aa0ad337148,/down/originals/2021-1/51320_2001.pdf,deb3ffa297973eaac15e526fb33b34bf,True,,,Ambitions for Britain,51320_200106,51320_200106_23
Energy,,,445,51320_200106,51320,200106,english,MARPOR,False,True,False,8a16cb00ecf05f0ec40a7aa0ad337148,/down/originals/2021-1/51320_2001.pdf,deb3ffa297973eaac15e526fb33b34bf,True,,,Ambitions for Britain,51320_200106,51320_200106_23
"Labour is committed to a secure, diverse and sustainable supply of energy at competitive prices.",403,,446,51320_200106,51320,200106,english,MARPOR,False,True,False,8a16cb00ecf05f0ec40a7aa0ad337148,/down/originals/2021-1/51320_2001.pdf,deb3ffa297973eaac15e526fb33b34bf,True,,,Ambitions for Britain,51320_200106,51320_200106_23
We have brought full competition to the gas and electricity markets.,403,,447,51320_200106,51320,200106,english,MARPOR,False,True,False,8a16cb00ecf05f0ec40a7aa0ad337148,/down/originals/2021-1/51320_2001.pdf,deb3ffa297973eaac15e526fb33b34bf,True,,,Ambitions for Britain,51320_200106,51320_200106_23
Coal and nuclear energy currently play import roles in ensuring diversity in our sources of electricity generation.,403,,448,51320_200106,51320,200106,english,MARPOR,False,True,False,8a16cb00ecf05f0ec40a7aa0ad337148,/down/originals/2021-1/51320_2001.pdf,deb3ffa297973eaac15e526fb33b34bf,True,,,Ambitions for Britain,51320_200106,51320_200106_23
"We are putting an obligation on electricity companies to deliver ten per cent of the UK’s electricity from renewable sources by 2010, with a doubling of combined heat and power.",501,,449,51320_200106,51320,200106,english,MARPOR,False,True,False,8a16cb00ecf05f0ec40a7aa0ad337148,/down/originals/2021-1/51320_2001.pdf,deb3ffa297973eaac15e526fb33b34bf,True,,,Ambitions for Britain,51320_200106,51320_200106_23
"We will consider setting further targets for renewables, with particular focus on offshore wind, solar and biomass technologies, supported by a £100 million fund.",501,,450,51320_200106,51320,200106,english,MARPOR,False,True,False,8a16cb00ecf05f0ec40a7aa0ad337148,/down/originals/2021-1/51320_2001.pdf,deb3ffa297973eaac15e526fb33b34bf,True,,,Ambitions for Britain,51320_200106,51320_200106_23
"It will back up the Climate Change Levy, which includes agreements to improve efficiency in energy-intensive sectors, and the new Carbon Trust, which will recycle £100 million to accelerate the take-up of cost-effective, low-carbon technologies.",501,,451,51320_200106,51320,200106,english,MARPOR,False,True,False,8a16cb00ecf05f0ec40a7aa0ad337148,/down/originals/2021-1/51320_2001.pdf,deb3ffa297973eaac15e526fb33b34bf,True,,,Ambitions for Britain,51320_200106,51320_200106_23
We will support research into clean coal technology and investigate its commercial possibilities.,501,,452,51320_200106,51320,200106,english,MARPOR,False,True,False,8a16cb00ecf05f0ec40a7aa0ad337148,/down/originals/2021-1/51320_2001.pdf,deb3ffa297973eaac15e526fb33b34bf,True,,,Ambitions for Britain,51320_200106,51320_200106_23
We will double the expenditure on energy efficiency.,501,,453,51320_200106,51320,200106,english,MARPOR,False,True,False,8a16cb00ecf05f0ec40a7aa0ad337148,/down/originals/2021-1/51320_2001.pdf,deb3ffa297973eaac15e526fb33b34bf,True,,,Ambitions for Britain,51320_200106,51320_200106_23
Fuel poverty blights lives: our aim is that by 2010 no vulnerable household in the UK need risk ill-health due to a cold home.,503,,454,51320_200106,51320,200106,english,MARPOR,False,True,False,8a16cb00ecf05f0ec40a7aa0ad337148,/down/originals/2021-1/51320_2001.pdf,deb3ffa297973eaac15e526fb33b34bf,True,,,Ambitions for Britain,51320_200106,51320_200106_23
BNFL is an important employer and major exporter.,000,,455,51320_200106,51320,200106,english,MARPOR,False,True,False,8a16cb00ecf05f0ec40a7aa0ad337148,/down/originals/2021-1/51320_2001.pdf,deb3ffa297973eaac15e526fb33b34bf,True,,,Ambitions for Britain,51320_200106,51320_200106_23
"The government insists it maintains the highest health, safety and environmental standards.",405,,456,51320_200106,51320,200106,english,MARPOR,False,True,False,8a16cb00ecf05f0ec40a7aa0ad337148,/down/originals/2021-1/51320_2001.pdf,deb3ffa297973eaac15e526fb33b34bf,True,,,Ambitions for Britain,51320_200106,51320_200106_23
We are examining the scope for turning the company into a public-private partnership.,405,,457,51320_200106,51320,200106,english,MARPOR,False,True,False,8a16cb00ecf05f0ec40a7aa0ad337148,/down/originals/2021-1/51320_2001.pdf,deb3ffa297973eaac15e526fb33b34bf,True,,,Ambitions for Britain,51320_200106,51320_200106_23
4. Europe and the wider world.,,,458,51320_200106,51320,200106,english,MARPOR,False,True,False,8a16cb00ecf05f0ec40a7aa0ad337148,/down/originals/2021-1/51320_2001.pdf,deb3ffa297973eaac15e526fb33b34bf,True,,,Ambitions for Britain,51320_200106,51320_200106_23
"Labour will be engaged and influential, fighting for the British national interest, as we set out in ‘Britain strong in the world’.",109,,459,51320_200106,51320,200106,english,MARPOR,False,True,False,8a16cb00ecf05f0ec40a7aa0ad337148,/down/originals/2021-1/51320_2001.pdf,deb3ffa297973eaac15e526fb33b34bf,True,,,Ambitions for Britain,51320_200106,51320_200106_23
"We will support British Trade International, which gives business direct access to UK posts abroad, and maintain the UK’s position as the location of choice within Europe for multinational business.",109,,460,51320_200106,51320,200106,english,MARPOR,False,True,False,8a16cb00ecf05f0ec40a7aa0ad337148,/down/originals/2021-1/51320_2001.pdf,deb3ffa297973eaac15e526fb33b34bf,True,,,Ambitions for Britain,51320_200106,51320_200106_23
Labour’s position on the single currency was set out by the Chancellor in October 1997 and reiterated by the Prime Minister in February 1999.,108,,461,51320_200106,51320,200106,english,MARPOR,False,True,False,8a16cb00ecf05f0ec40a7aa0ad337148,/down/originals/2021-1/51320_2001.pdf,deb3ffa297973eaac15e526fb33b34bf,True,,,Ambitions for Britain,51320_200106,51320_200106_24
"We have made it clear that, provided the economic conditions are met, membership of a successful Euro would bring benefits to Britain in terms of jobs, investment and trade.",108,,462,51320_200106,51320,200106,english,MARPOR,False,True,False,8a16cb00ecf05f0ec40a7aa0ad337148,/down/originals/2021-1/51320_2001.pdf,deb3ffa297973eaac15e526fb33b34bf,True,,,Ambitions for Britain,51320_200106,51320_200106_24
"So, in principle, we are in favour of joining a successful single currency.",108,,463,51320_200106,51320,200106,english,MARPOR,False,True,False,8a16cb00ecf05f0ec40a7aa0ad337148,/down/originals/2021-1/51320_2001.pdf,deb3ffa297973eaac15e526fb33b34bf,True,,,Ambitions for Britain,51320_200106,51320_200106_24
"But, in practice, the five economic tests we have set out must be met before the government would recommend entry to the single currency.",108,,464,51320_200106,51320,200106,english,MARPOR,False,True,False,8a16cb00ecf05f0ec40a7aa0ad337148,/down/originals/2021-1/51320_2001.pdf,deb3ffa297973eaac15e526fb33b34bf,True,,,Ambitions for Britain,51320_200106,51320_200106_24
An assessment of the tests will be carried out early in the next Parliament.,108,,465,51320_200106,51320,200106,english,MARPOR,False,True,False,8a16cb00ecf05f0ec40a7aa0ad337148,/down/originals/2021-1/51320_2001.pdf,deb3ffa297973eaac15e526fb33b34bf,True,,,Ambitions for Britain,51320_200106,51320_200106_24
"If the government and Parliament recommend entry, the British people will have the final say in a referendum.",202,,466,51320_200106,51320,200106,english,MARPOR,False,True,False,8a16cb00ecf05f0ec40a7aa0ad337148,/down/originals/2021-1/51320_2001.pdf,deb3ffa297973eaac15e526fb33b34bf,True,,,Ambitions for Britain,51320_200106,51320_200106_24
"So the choice is between a Conservative Party which will deny the people of Britain the chance to join, even if it is in our national interest to do so – and the Labour Party which says that, if it is in our national economic interest, the decision should be made by the British people in a referendum.",305,,467,51320_200106,51320,200106,english,MARPOR,False,True,False,8a16cb00ecf05f0ec40a7aa0ad337148,/down/originals/2021-1/51320_2001.pdf,deb3ffa297973eaac15e526fb33b34bf,True,,,Ambitions for Britain,51320_200106,51320_200106_24
No one left behind – Helping everyone become better off,,,468,51320_200106,51320,200106,english,MARPOR,False,True,False,8a16cb00ecf05f0ec40a7aa0ad337148,/down/originals/2021-1/51320_2001.pdf,deb3ffa297973eaac15e526fb33b34bf,True,,,Ambitions for Britain,51320_200106,51320_200106_24
Britain is better off than in 1997 – but our ambition is to widen the winners’ circle so more people share in the benefits of economic growth.,305,,469,51320_200106,51320,200106,english,MARPOR,False,True,False,8a16cb00ecf05f0ec40a7aa0ad337148,/down/originals/2021-1/51320_2001.pdf,deb3ffa297973eaac15e526fb33b34bf,True,,,Ambitions for Britain,51320_200106,51320_200106_24
In ‘A modern welfare state’ we set out the route to full employment.,408,,470,51320_200106,51320,200106,english,MARPOR,False,True,False,8a16cb00ecf05f0ec40a7aa0ad337148,/down/originals/2021-1/51320_2001.pdf,deb3ffa297973eaac15e526fb33b34bf,True,,,Ambitions for Britain,51320_200106,51320_200106_24
Fair and flexible work.,,,471,51320_200106,51320,200106,english,MARPOR,False,True,False,8a16cb00ecf05f0ec40a7aa0ad337148,/down/originals/2021-1/51320_2001.pdf,deb3ffa297973eaac15e526fb33b34bf,True,,,Ambitions for Britain,51320_200106,51320_200106_24
We are proud of our commitment to combine a dynamic economy with fair standards in the workplace.,408,,472,51320_200106,51320,200106,english,MARPOR,False,True,False,8a16cb00ecf05f0ec40a7aa0ad337148,/down/originals/2021-1/51320_2001.pdf,deb3ffa297973eaac15e526fb33b34bf,True,,,Ambitions for Britain,51320_200106,51320_200106_24
Labour has put right historic wrongs.,305,,473,51320_200106,51320,200106,english,MARPOR,False,True,False,8a16cb00ecf05f0ec40a7aa0ad337148,/down/originals/2021-1/51320_2001.pdf,deb3ffa297973eaac15e526fb33b34bf,True,,,Ambitions for Britain,51320_200106,51320_200106_24
Every employee now has the right to four weeks’ paid holiday; trade unions have the right to recognition where a majority of the workforce want it; part-time workers have proper rights.,405,,474,51320_200106,51320,200106,english,MARPOR,False,True,False,8a16cb00ecf05f0ec40a7aa0ad337148,/down/originals/2021-1/51320_2001.pdf,deb3ffa297973eaac15e526fb33b34bf,True,,,Ambitions for Britain,51320_200106,51320_200106_24
Our objective has been to promote fairness consistent with the competitive position of British business.,405,,475,51320_200106,51320,200106,english,MARPOR,False,True,False,8a16cb00ecf05f0ec40a7aa0ad337148,/down/originals/2021-1/51320_2001.pdf,deb3ffa297973eaac15e526fb33b34bf,True,,,Ambitions for Britain,51320_200106,51320_200106_24
That will continue to be our position.,405,,476,51320_200106,51320,200106,english,MARPOR,False,True,False,8a16cb00ecf05f0ec40a7aa0ad337148,/down/originals/2021-1/51320_2001.pdf,deb3ffa297973eaac15e526fb33b34bf,True,,,Ambitions for Britain,51320_200106,51320_200106_24
We have reformed the labour market to build a durable and fair basis for constructive employee relations.,405,,477,51320_200106,51320,200106,english,MARPOR,False,True,False,8a16cb00ecf05f0ec40a7aa0ad337148,/down/originals/2021-1/51320_2001.pdf,deb3ffa297973eaac15e526fb33b34bf,True,,,Ambitions for Britain,51320_200106,51320_200106_24
"As we learn from the reforms, we will keep their effectiveness under review.",405,,478,51320_200106,51320,200106,english,MARPOR,False,True,False,8a16cb00ecf05f0ec40a7aa0ad337148,/down/originals/2021-1/51320_2001.pdf,deb3ffa297973eaac15e526fb33b34bf,True,,,Ambitions for Britain,51320_200106,51320_200106_24
"We want to strengthen partnership at work, which can foster employee commitment and help at a time of industrial change.",405,,479,51320_200106,51320,200106,english,MARPOR,False,True,False,8a16cb00ecf05f0ec40a7aa0ad337148,/down/originals/2021-1/51320_2001.pdf,deb3ffa297973eaac15e526fb33b34bf,True,,,Ambitions for Britain,51320_200106,51320_200106_24
We have established the Partnership Fund and want to expand it.,405,,480,51320_200106,51320,200106,english,MARPOR,False,True,False,8a16cb00ecf05f0ec40a7aa0ad337148,/down/originals/2021-1/51320_2001.pdf,deb3ffa297973eaac15e526fb33b34bf,True,,,Ambitions for Britain,51320_200106,51320_200106_24
"Information and consultation need to be appropriate to national traditions, with timely discussion of problems.",405,,481,51320_200106,51320,200106,english,MARPOR,False,True,False,8a16cb00ecf05f0ec40a7aa0ad337148,/down/originals/2021-1/51320_2001.pdf,deb3ffa297973eaac15e526fb33b34bf,True,,,Ambitions for Britain,51320_200106,51320_200106_25
"When large-scale redundancies are being considered, there is an especially strong case for consultation.",405,,482,51320_200106,51320,200106,english,MARPOR,False,True,False,8a16cb00ecf05f0ec40a7aa0ad337148,/down/originals/2021-1/51320_2001.pdf,deb3ffa297973eaac15e526fb33b34bf,True,,,Ambitions for Britain,51320_200106,51320_200106_25
The government is reviewing the effectiveness of the UK’s current arrangements for information and consultation – works councils in larger firms operating across Europe as well as consultation on large-scale redundancies.,405,,483,51320_200106,51320,200106,english,MARPOR,False,True,False,8a16cb00ecf05f0ec40a7aa0ad337148,/down/originals/2021-1/51320_2001.pdf,deb3ffa297973eaac15e526fb33b34bf,True,,,Ambitions for Britain,51320_200106,51320_200106_25
We will implement the findings of our review in this area.,405,,484,51320_200106,51320,200106,english,MARPOR,False,True,False,8a16cb00ecf05f0ec40a7aa0ad337148,/down/originals/2021-1/51320_2001.pdf,deb3ffa297973eaac15e526fb33b34bf,True,,,Ambitions for Britain,51320_200106,51320_200106_25
We support conciliation in the workplace to avoid resort to litigation.,405,,485,51320_200106,51320,200106,english,MARPOR,False,True,False,8a16cb00ecf05f0ec40a7aa0ad337148,/down/originals/2021-1/51320_2001.pdf,deb3ffa297973eaac15e526fb33b34bf,True,,,Ambitions for Britain,51320_200106,51320_200106_25
We will examine reforms that promote efficiency and fairness.,405,,486,51320_200106,51320,200106,english,MARPOR,False,True,False,8a16cb00ecf05f0ec40a7aa0ad337148,/down/originals/2021-1/51320_2001.pdf,deb3ffa297973eaac15e526fb33b34bf,True,,,Ambitions for Britain,51320_200106,51320_200106_25
Women still suffer an 18 per cent pay gap compared to men.,706,,487,51320_200106,51320,200106,english,MARPOR,False,True,False,8a16cb00ecf05f0ec40a7aa0ad337148,/down/originals/2021-1/51320_2001.pdf,deb3ffa297973eaac15e526fb33b34bf,True,,,Ambitions for Britain,51320_200106,51320_200106_25
We are committed to tackling the causes of this inequality.,706,,488,51320_200106,51320,200106,english,MARPOR,False,True,False,8a16cb00ecf05f0ec40a7aa0ad337148,/down/originals/2021-1/51320_2001.pdf,deb3ffa297973eaac15e526fb33b34bf,True,,,Ambitions for Britain,51320_200106,51320_200106_25
"We will work with employers and employees to develop effective proposals, building on good practice and the sound business case, in both the private and public sectors.",405,,489,51320_200106,51320,200106,english,MARPOR,False,True,False,8a16cb00ecf05f0ec40a7aa0ad337148,/down/originals/2021-1/51320_2001.pdf,deb3ffa297973eaac15e526fb33b34bf,True,,,Ambitions for Britain,51320_200106,51320_200106_25
