text,cmp_code,eu_code,pos,manifesto_id,party,date,language,source,has_eu_code,is_primary_doc,may_contradict_core_dataset,md5sum_text,url_original,md5sum_original,annotations,handbook,is_copy_of,title,id,manifesto_id_section
Statutory maternity leave is currently 18 weeks; we propose to increase it to six months.,504,,1099,51320_200106,51320,200106,english,MARPOR,False,True,False,8a16cb00ecf05f0ec40a7aa0ad337148,/down/originals/2021-1/51320_2001.pdf,deb3ffa297973eaac15e526fb33b34bf,True,,,Ambitions for Britain,51320_200106,51320_200106_55
"Statutory maternity pay is paid at a flat rate of £60 a week; we propose to increase it to £100 per week, as big an increase in the next two years as in the past 40 years.",504,,1100,51320_200106,51320,200106,english,MARPOR,False,True,False,8a16cb00ecf05f0ec40a7aa0ad337148,/down/originals/2021-1/51320_2001.pdf,deb3ffa297973eaac15e526fb33b34bf,True,,,Ambitions for Britain,51320_200106,51320_200106_55
"Fathers currently have no legal right to paid time off on the birth of a child; we propose to introduce it for two weeks, also paid at £100 per week.",504,,1101,51320_200106,51320,200106,english,MARPOR,False,True,False,8a16cb00ecf05f0ec40a7aa0ad337148,/down/originals/2021-1/51320_2001.pdf,deb3ffa297973eaac15e526fb33b34bf,True,,,Ambitions for Britain,51320_200106,51320_200106_56
We need to do more to help parents balance work and family.,603,,1102,51320_200106,51320,200106,english,MARPOR,False,True,False,8a16cb00ecf05f0ec40a7aa0ad337148,/down/originals/2021-1/51320_2001.pdf,deb3ffa297973eaac15e526fb33b34bf,True,,,Ambitions for Britain,51320_200106,51320_200106_56
"Many parents, especially mothers, want to work reduced hours when they do go back to work.",603,,1103,51320_200106,51320,200106,english,MARPOR,False,True,False,8a16cb00ecf05f0ec40a7aa0ad337148,/down/originals/2021-1/51320_2001.pdf,deb3ffa297973eaac15e526fb33b34bf,True,,,Ambitions for Britain,51320_200106,51320_200106_56
We will work with business and employees to combine flexible working with the needs of business.,701,,1104,51320_200106,51320,200106,english,MARPOR,False,True,False,8a16cb00ecf05f0ec40a7aa0ad337148,/down/originals/2021-1/51320_2001.pdf,deb3ffa297973eaac15e526fb33b34bf,True,,,Ambitions for Britain,51320_200106,51320_200106_56
Child Support Agency.,,,1105,51320_200106,51320,200106,english,MARPOR,False,True,False,8a16cb00ecf05f0ec40a7aa0ad337148,/down/originals/2021-1/51320_2001.pdf,deb3ffa297973eaac15e526fb33b34bf,True,,,Ambitions for Britain,51320_200106,51320_200106_56
Some families break up.,603,,1106,51320_200106,51320,200106,english,MARPOR,False,True,False,8a16cb00ecf05f0ec40a7aa0ad337148,/down/originals/2021-1/51320_2001.pdf,deb3ffa297973eaac15e526fb33b34bf,True,,,Ambitions for Britain,51320_200106,51320_200106_56
Government’s role is to ensure that both parents retain responsibility for the financial support of their children where they are able to do so.,603,,1107,51320_200106,51320,200106,english,MARPOR,False,True,False,8a16cb00ecf05f0ec40a7aa0ad337148,/down/originals/2021-1/51320_2001.pdf,deb3ffa297973eaac15e526fb33b34bf,True,,,Ambitions for Britain,51320_200106,51320_200106_56
"We have always supported the principle underlying the work of the Child Support Agency (CSA), but the Conservatives bungled its introduction.",305,,1108,51320_200106,51320,200106,english,MARPOR,False,True,False,8a16cb00ecf05f0ec40a7aa0ad337148,/down/originals/2021-1/51320_2001.pdf,deb3ffa297973eaac15e526fb33b34bf,True,,,Ambitions for Britain,51320_200106,51320_200106_56
That is why we have already legislated to reform the CSA and these improvements will come on stream from 2002.,603,,1109,51320_200106,51320,200106,english,MARPOR,False,True,False,8a16cb00ecf05f0ec40a7aa0ad337148,/down/originals/2021-1/51320_2001.pdf,deb3ffa297973eaac15e526fb33b34bf,True,,,Ambitions for Britain,51320_200106,51320_200106_56
"A simple system will ensure a better deal for children, that fathers pay a fair share, that mothers benefit from their doing so, and that tougher action is taken against parents who do not comply.",603,,1110,51320_200106,51320,200106,english,MARPOR,False,True,False,8a16cb00ecf05f0ec40a7aa0ad337148,/down/originals/2021-1/51320_2001.pdf,deb3ffa297973eaac15e526fb33b34bf,True,,,Ambitions for Britain,51320_200106,51320_200106_56
Pensions and Pensioners,,,1111,51320_200106,51320,200106,english,MARPOR,False,True,False,8a16cb00ecf05f0ec40a7aa0ad337148,/down/originals/2021-1/51320_2001.pdf,deb3ffa297973eaac15e526fb33b34bf,True,,,Ambitions for Britain,51320_200106,51320_200106_56
In 1997 Labour made a clear commitment to ensure pensioners share fairly in the rising prosperity of the nation.,305,,1112,51320_200106,51320,200106,english,MARPOR,False,True,False,8a16cb00ecf05f0ec40a7aa0ad337148,/down/originals/2021-1/51320_2001.pdf,deb3ffa297973eaac15e526fb33b34bf,True,,,Ambitions for Britain,51320_200106,51320_200106_56
"At this election, we repeat our commitment to pensioners – we honour your lifetime of work by ensuring that you share fairly in the nation’s rising prosperity, and are committed to tackling pensioner poverty.",706,,1113,51320_200106,51320,200106,english,MARPOR,False,True,False,8a16cb00ecf05f0ec40a7aa0ad337148,/down/originals/2021-1/51320_2001.pdf,deb3ffa297973eaac15e526fb33b34bf,True,,,Ambitions for Britain,51320_200106,51320_200106_56
We will build a secure system on the foundation of the basic state pension.,706,,1114,51320_200106,51320,200106,english,MARPOR,False,True,False,8a16cb00ecf05f0ec40a7aa0ad337148,/down/originals/2021-1/51320_2001.pdf,deb3ffa297973eaac15e526fb33b34bf,True,,,Ambitions for Britain,51320_200106,51320_200106_56
"As a result of Labour’s policies, in this Parliament spending on pensioners will be £4.5 billion a year more in real terms than in 1997.",305,,1115,51320_200106,51320,200106,english,MARPOR,False,True,False,8a16cb00ecf05f0ec40a7aa0ad337148,/down/originals/2021-1/51320_2001.pdf,deb3ffa297973eaac15e526fb33b34bf,True,,,Ambitions for Britain,51320_200106,51320_200106_56
"Of this, £2 billion is going to the poorest third of pensioners.",305,,1116,51320_200106,51320,200106,english,MARPOR,False,True,False,8a16cb00ecf05f0ec40a7aa0ad337148,/down/originals/2021-1/51320_2001.pdf,deb3ffa297973eaac15e526fb33b34bf,True,,,Ambitions for Britain,51320_200106,51320_200106_56
"Our first priority was to help those on lowest incomes: we have lifted the incomes of the 1.7 million poorest pensioners by at least £800 a year, and for some couples by up to £1,400.",305,,1117,51320_200106,51320,200106,english,MARPOR,False,True,False,8a16cb00ecf05f0ec40a7aa0ad337148,/down/originals/2021-1/51320_2001.pdf,deb3ffa297973eaac15e526fb33b34bf,True,,,Ambitions for Britain,51320_200106,51320_200106_56
Pensioner households are on average £11 per week better off than they were in 1997; and over three million pensioner households benefit from free TV licences for those over-75s.,305,,1118,51320_200106,51320,200106,english,MARPOR,False,True,False,8a16cb00ecf05f0ec40a7aa0ad337148,/down/originals/2021-1/51320_2001.pdf,deb3ffa297973eaac15e526fb33b34bf,True,,,Ambitions for Britain,51320_200106,51320_200106_56
The pensioners tax allowance means six out of ten pensioners pay no tax.,305,,1119,51320_200106,51320,200106,english,MARPOR,False,True,False,8a16cb00ecf05f0ec40a7aa0ad337148,/down/originals/2021-1/51320_2001.pdf,deb3ffa297973eaac15e526fb33b34bf,True,,,Ambitions for Britain,51320_200106,51320_200106_56
We have halved the rate of tax they pay on savings income.,305,,1120,51320_200106,51320,200106,english,MARPOR,False,True,False,8a16cb00ecf05f0ec40a7aa0ad337148,/down/originals/2021-1/51320_2001.pdf,deb3ffa297973eaac15e526fb33b34bf,True,,,Ambitions for Britain,51320_200106,51320_200106_56
We have pledged to extend tax allowances further so that by 2003 no pensioner pays tax until their income reaches £127 per week.,305,,1121,51320_200106,51320,200106,english,MARPOR,False,True,False,8a16cb00ecf05f0ec40a7aa0ad337148,/down/originals/2021-1/51320_2001.pdf,deb3ffa297973eaac15e526fb33b34bf,True,,,Ambitions for Britain,51320_200106,51320_200106_57
We now need to go further.,305,,1122,51320_200106,51320,200106,english,MARPOR,False,True,False,8a16cb00ecf05f0ec40a7aa0ad337148,/down/originals/2021-1/51320_2001.pdf,deb3ffa297973eaac15e526fb33b34bf,True,,,Ambitions for Britain,51320_200106,51320_200106_57
"With Labour, the basic state pension will rise by 2003 to £77 a week for a single pensioner and £123 a week for a pensioner couple.",504,,1123,51320_200106,51320,200106,english,MARPOR,False,True,False,8a16cb00ecf05f0ec40a7aa0ad337148,/down/originals/2021-1/51320_2001.pdf,deb3ffa297973eaac15e526fb33b34bf,True,,,Ambitions for Britain,51320_200106,51320_200106_57
"We guarantee that the Minimum Income Guarantee will be uprated each year in line with earnings, throughout the next Parliament.",504,,1124,51320_200106,51320,200106,english,MARPOR,False,True,False,8a16cb00ecf05f0ec40a7aa0ad337148,/down/originals/2021-1/51320_2001.pdf,deb3ffa297973eaac15e526fb33b34bf,True,,,Ambitions for Britain,51320_200106,51320_200106_57
"In 2003, this will mean no single pensioner will have an income below £100 per week and no pensioner couple an income below £154 per week.",706,,1125,51320_200106,51320,200106,english,MARPOR,False,True,False,8a16cb00ecf05f0ec40a7aa0ad337148,/down/originals/2021-1/51320_2001.pdf,deb3ffa297973eaac15e526fb33b34bf,True,,,Ambitions for Britain,51320_200106,51320_200106_57
Labour introduced the Winter Fuel Payment.,305,,1126,51320_200106,51320,200106,english,MARPOR,False,True,False,8a16cb00ecf05f0ec40a7aa0ad337148,/down/originals/2021-1/51320_2001.pdf,deb3ffa297973eaac15e526fb33b34bf,True,,,Ambitions for Britain,51320_200106,51320_200106_57
Its level is set each year.,000,,1127,51320_200106,51320,200106,english,MARPOR,False,True,False,8a16cb00ecf05f0ec40a7aa0ad337148,/down/originals/2021-1/51320_2001.pdf,deb3ffa297973eaac15e526fb33b34bf,True,,,Ambitions for Britain,51320_200106,51320_200106_57
Last winter it was raised to £200.,305,,1128,51320_200106,51320,200106,english,MARPOR,False,True,False,8a16cb00ecf05f0ec40a7aa0ad337148,/down/originals/2021-1/51320_2001.pdf,deb3ffa297973eaac15e526fb33b34bf,True,,,Ambitions for Britain,51320_200106,51320_200106_57
For next winter it will also be £200.,504,,1129,51320_200106,51320,200106,english,MARPOR,False,True,False,8a16cb00ecf05f0ec40a7aa0ad337148,/down/originals/2021-1/51320_2001.pdf,deb3ffa297973eaac15e526fb33b34bf,True,,,Ambitions for Britain,51320_200106,51320_200106_57
We will also do more to reward pensioners who have saved.,706,,1130,51320_200106,51320,200106,english,MARPOR,False,True,False,8a16cb00ecf05f0ec40a7aa0ad337148,/down/originals/2021-1/51320_2001.pdf,deb3ffa297973eaac15e526fb33b34bf,True,,,Ambitions for Britain,51320_200106,51320_200106_57
"Pensioners who work and save will find, for the first time ever, the government rewarding their saving.",706,,1131,51320_200106,51320,200106,english,MARPOR,False,True,False,8a16cb00ecf05f0ec40a7aa0ad337148,/down/originals/2021-1/51320_2001.pdf,deb3ffa297973eaac15e526fb33b34bf,True,,,Ambitions for Britain,51320_200106,51320_200106_57
Pensioner couples with an income up to £200 per week and single pensioners with income up to £135 per week will be rewarded for saving – the government adding up to 60p for each £1 of savings income up to a maximum of £23.,706,,1132,51320_200106,51320,200106,english,MARPOR,False,True,False,8a16cb00ecf05f0ec40a7aa0ad337148,/down/originals/2021-1/51320_2001.pdf,deb3ffa297973eaac15e526fb33b34bf,True,,,Ambitions for Britain,51320_200106,51320_200106_57
"In the process, we will abolish the weekly means test for pensioners, along with removing the unfair test of savings, which penalises pensioners who have modest savings and whose thrift should be recognised.",706,,1133,51320_200106,51320,200106,english,MARPOR,False,True,False,8a16cb00ecf05f0ec40a7aa0ad337148,/down/originals/2021-1/51320_2001.pdf,deb3ffa297973eaac15e526fb33b34bf,True,,,Ambitions for Britain,51320_200106,51320_200106_57
It is also vital to have in place long-term pension reform.,414,,1134,51320_200106,51320,200106,english,MARPOR,False,True,False,8a16cb00ecf05f0ec40a7aa0ad337148,/down/originals/2021-1/51320_2001.pdf,deb3ffa297973eaac15e526fb33b34bf,True,,,Ambitions for Britain,51320_200106,51320_200106_57
We support a fair balance of public and private provision.,414,,1135,51320_200106,51320,200106,english,MARPOR,False,True,False,8a16cb00ecf05f0ec40a7aa0ad337148,/down/originals/2021-1/51320_2001.pdf,deb3ffa297973eaac15e526fb33b34bf,True,,,Ambitions for Britain,51320_200106,51320_200106_57
"Occupational and personal pensions, properly regulated, will continue to offer security for middle and high earners.",414,,1136,51320_200106,51320,200106,english,MARPOR,False,True,False,8a16cb00ecf05f0ec40a7aa0ad337148,/down/originals/2021-1/51320_2001.pdf,deb3ffa297973eaac15e526fb33b34bf,True,,,Ambitions for Britain,51320_200106,51320_200106_57
We will continue discussions on annuity reform to ensure tax rules do not unnecessarily restrict the development of annuity products and markets.,414,,1137,51320_200106,51320,200106,english,MARPOR,False,True,False,8a16cb00ecf05f0ec40a7aa0ad337148,/down/originals/2021-1/51320_2001.pdf,deb3ffa297973eaac15e526fb33b34bf,True,,,Ambitions for Britain,51320_200106,51320_200106_57
"For low- to middle-income earners, stakeholder pensions cap costs, guarantee value for money, offer flexibility, and drive down fees across the board.",414,,1138,51320_200106,51320,200106,english,MARPOR,False,True,False,8a16cb00ecf05f0ec40a7aa0ad337148,/down/originals/2021-1/51320_2001.pdf,deb3ffa297973eaac15e526fb33b34bf,True,,,Ambitions for Britain,51320_200106,51320_200106_57
"And for the lowest paid and carers, full-time parents and people with disabilities, the state second pension will top up their pension contributions to give a decent pension in retirement to 18 million people.",705,,1139,51320_200106,51320,200106,english,MARPOR,False,True,False,8a16cb00ecf05f0ec40a7aa0ad337148,/down/originals/2021-1/51320_2001.pdf,deb3ffa297973eaac15e526fb33b34bf,True,,,Ambitions for Britain,51320_200106,51320_200106_57
Today’s pensioners have much to give to society.,000,,1140,51320_200106,51320,200106,english,MARPOR,False,True,False,8a16cb00ecf05f0ec40a7aa0ad337148,/down/originals/2021-1/51320_2001.pdf,deb3ffa297973eaac15e526fb33b34bf,True,,,Ambitions for Britain,51320_200106,51320_200106_57
Labour’s NHS Plan offers £1. 4 billion of investment for older people to promote better health and support independence.,504,,1141,51320_200106,51320,200106,english,MARPOR,False,True,False,8a16cb00ecf05f0ec40a7aa0ad337148,/down/originals/2021-1/51320_2001.pdf,deb3ffa297973eaac15e526fb33b34bf,True,,,Ambitions for Britain,51320_200106,51320_200106_58
"Pensioners also need simple, accessible services that treat them with dignity and promote independence.",706,,1142,51320_200106,51320,200106,english,MARPOR,False,True,False,8a16cb00ecf05f0ec40a7aa0ad337148,/down/originals/2021-1/51320_2001.pdf,deb3ffa297973eaac15e526fb33b34bf,True,,,Ambitions for Britain,51320_200106,51320_200106_58
"We will build on Care Direct to provide a better integration of health, housing, benefits and social care for older people.",706,,1143,51320_200106,51320,200106,english,MARPOR,False,True,False,8a16cb00ecf05f0ec40a7aa0ad337148,/down/originals/2021-1/51320_2001.pdf,deb3ffa297973eaac15e526fb33b34bf,True,,,Ambitions for Britain,51320_200106,51320_200106_58
This will be an integrated ‘third age service’ to help older people and those who care for them.,706,,1144,51320_200106,51320,200106,english,MARPOR,False,True,False,8a16cb00ecf05f0ec40a7aa0ad337148,/down/originals/2021-1/51320_2001.pdf,deb3ffa297973eaac15e526fb33b34bf,True,,,Ambitions for Britain,51320_200106,51320_200106_58
Carers.,,,1145,51320_200106,51320,200106,english,MARPOR,False,True,False,8a16cb00ecf05f0ec40a7aa0ad337148,/down/originals/2021-1/51320_2001.pdf,deb3ffa297973eaac15e526fb33b34bf,True,,,Ambitions for Britain,51320_200106,51320_200106_58
"Not only are the large majority of people who require care older, but also the majority of carers are older people.",706,,1146,51320_200106,51320,200106,english,MARPOR,False,True,False,8a16cb00ecf05f0ec40a7aa0ad337148,/down/originals/2021-1/51320_2001.pdf,deb3ffa297973eaac15e526fb33b34bf,True,,,Ambitions for Britain,51320_200106,51320_200106_58
Labour will tackle the problems faced by people requiring care and the problems of carers themselves.,706,,1147,51320_200106,51320,200106,english,MARPOR,False,True,False,8a16cb00ecf05f0ec40a7aa0ad337148,/down/originals/2021-1/51320_2001.pdf,deb3ffa297973eaac15e526fb33b34bf,True,,,Ambitions for Britain,51320_200106,51320_200106_58
"The national carers strategy is the first step, with information, support and care for carers: Labour will spend £500 million over the next three years providing financial support for 300,000 carers through the benefits system, and £255 million for social care services for carers.",504,,1148,51320_200106,51320,200106,english,MARPOR,False,True,False,8a16cb00ecf05f0ec40a7aa0ad337148,/down/originals/2021-1/51320_2001.pdf,deb3ffa297973eaac15e526fb33b34bf,True,,,Ambitions for Britain,51320_200106,51320_200106_58
"More is being done for carers through income support; carers will be better able to combine work and care; and 75,000 more carers each year are now able to take a break from their caring responsibilites.",706,,1149,51320_200106,51320,200106,english,MARPOR,False,True,False,8a16cb00ecf05f0ec40a7aa0ad337148,/down/originals/2021-1/51320_2001.pdf,deb3ffa297973eaac15e526fb33b34bf,True,,,Ambitions for Britain,51320_200106,51320_200106_58
"We are proud that, with Labour, care by qualified nurses will be made free to all, wherever it is received.",504,,1150,51320_200106,51320,200106,english,MARPOR,False,True,False,8a16cb00ecf05f0ec40a7aa0ad337148,/down/originals/2021-1/51320_2001.pdf,deb3ffa297973eaac15e526fb33b34bf,True,,,Ambitions for Britain,51320_200106,51320_200106_58
One hundred and fifty thousand more older people will receive rehabilitation and convalescence through growing investment in the NHS and social services that the Tories refuse to match.,504,,1151,51320_200106,51320,200106,english,MARPOR,False,True,False,8a16cb00ecf05f0ec40a7aa0ad337148,/down/originals/2021-1/51320_2001.pdf,deb3ffa297973eaac15e526fb33b34bf,True,,,Ambitions for Britain,51320_200106,51320_200106_58
We want to see carers given access to the cash and services appropriate to their service to their relatives and the community.,706,,1152,51320_200106,51320,200106,english,MARPOR,False,True,False,8a16cb00ecf05f0ec40a7aa0ad337148,/down/originals/2021-1/51320_2001.pdf,deb3ffa297973eaac15e526fb33b34bf,True,,,Ambitions for Britain,51320_200106,51320_200106_58
The Carers and Disabled Children’s Act gives carers a right to an independent assessment of their needs.,706,,1153,51320_200106,51320,200106,english,MARPOR,False,True,False,8a16cb00ecf05f0ec40a7aa0ad337148,/down/originals/2021-1/51320_2001.pdf,deb3ffa297973eaac15e526fb33b34bf,True,,,Ambitions for Britain,51320_200106,51320_200106_58
We will examine the development of a fund to help local authorities produce tailored care packages to back up the results of these assessments.,706,,1154,51320_200106,51320,200106,english,MARPOR,False,True,False,8a16cb00ecf05f0ec40a7aa0ad337148,/down/originals/2021-1/51320_2001.pdf,deb3ffa297973eaac15e526fb33b34bf,True,,,Ambitions for Britain,51320_200106,51320_200106_58
Social inclusion,,,1155,51320_200106,51320,200106,english,MARPOR,False,True,False,8a16cb00ecf05f0ec40a7aa0ad337148,/down/originals/2021-1/51320_2001.pdf,deb3ffa297973eaac15e526fb33b34bf,True,,,Ambitions for Britain,51320_200106,51320_200106_58
"Social exclusion, affecting around ten per cent of the population, living in fewer than 1,000 of the most deprived wards in Britain, damages lives and wrecks communities.",000,,1156,51320_200106,51320,200106,english,MARPOR,False,True,False,8a16cb00ecf05f0ec40a7aa0ad337148,/down/originals/2021-1/51320_2001.pdf,deb3ffa297973eaac15e526fb33b34bf,True,,,Ambitions for Britain,51320_200106,51320_200106_58
"Before 1997, social exclusion was ignored.",305,,1157,51320_200106,51320,200106,english,MARPOR,False,True,False,8a16cb00ecf05f0ec40a7aa0ad337148,/down/originals/2021-1/51320_2001.pdf,deb3ffa297973eaac15e526fb33b34bf,True,,,Ambitions for Britain,51320_200106,51320_200106_58
"Now we have a new approach – improving the quality of mainstream services, preventing people falling between the cracks, and reintegrating them into society if things go wrong.",503,,1158,51320_200106,51320,200106,english,MARPOR,False,True,False,8a16cb00ecf05f0ec40a7aa0ad337148,/down/originals/2021-1/51320_2001.pdf,deb3ffa297973eaac15e526fb33b34bf,True,,,Ambitions for Britain,51320_200106,51320_200106_58
We have targeted five priorities:,,,1159,51320_200106,51320,200106,english,MARPOR,False,True,False,8a16cb00ecf05f0ec40a7aa0ad337148,/down/originals/2021-1/51320_2001.pdf,deb3ffa297973eaac15e526fb33b34bf,True,,,Ambitions for Britain,51320_200106,51320_200106_58
Homelessness,,,1160,51320_200106,51320,200106,english,MARPOR,False,True,False,8a16cb00ecf05f0ec40a7aa0ad337148,/down/originals/2021-1/51320_2001.pdf,deb3ffa297973eaac15e526fb33b34bf,True,,,Ambitions for Britain,51320_200106,51320_200106_58
The number of people living on the streets is down by one third since 1997.,305,,1161,51320_200106,51320,200106,english,MARPOR,False,True,False,8a16cb00ecf05f0ec40a7aa0ad337148,/down/originals/2021-1/51320_2001.pdf,deb3ffa297973eaac15e526fb33b34bf,True,,,Ambitions for Britain,51320_200106,51320_200106_59
Labour’s target is to cut rough sleeping to two-thirds of its 1998 level by 2002.,706,,1162,51320_200106,51320,200106,english,MARPOR,False,True,False,8a16cb00ecf05f0ec40a7aa0ad337148,/down/originals/2021-1/51320_2001.pdf,deb3ffa297973eaac15e526fb33b34bf,True,,,Ambitions for Britain,51320_200106,51320_200106_59
"Beyond then, we will maintain the drive to keep the number as low as possible.",706,,1163,51320_200106,51320,200106,english,MARPOR,False,True,False,8a16cb00ecf05f0ec40a7aa0ad337148,/down/originals/2021-1/51320_2001.pdf,deb3ffa297973eaac15e526fb33b34bf,True,,,Ambitions for Britain,51320_200106,51320_200106_59
Teenage pregnancy rates are falling,,,1164,51320_200106,51320,200106,english,MARPOR,False,True,False,8a16cb00ecf05f0ec40a7aa0ad337148,/down/originals/2021-1/51320_2001.pdf,deb3ffa297973eaac15e526fb33b34bf,True,,,Ambitions for Britain,51320_200106,51320_200106_59
Yet Britain has the highest rates in Europe.,000,,1165,51320_200106,51320,200106,english,MARPOR,False,True,False,8a16cb00ecf05f0ec40a7aa0ad337148,/down/originals/2021-1/51320_2001.pdf,deb3ffa297973eaac15e526fb33b34bf,True,,,Ambitions for Britain,51320_200106,51320_200106_59
"Labour’s strategy tackles the causes of teenage pregnancy, provides mothers under 18 with access to supervised housing if they cannot live at home, and ensures that, if they do have children, teenagers get access to training, education or work.",706,,1166,51320_200106,51320,200106,english,MARPOR,False,True,False,8a16cb00ecf05f0ec40a7aa0ad337148,/down/originals/2021-1/51320_2001.pdf,deb3ffa297973eaac15e526fb33b34bf,True,,,Ambitions for Britain,51320_200106,51320_200106_59
By 2004 we are pledged to reduce teenage pregnancy by 15 per cent.,706,,1167,51320_200106,51320,200106,english,MARPOR,False,True,False,8a16cb00ecf05f0ec40a7aa0ad337148,/down/originals/2021-1/51320_2001.pdf,deb3ffa297973eaac15e526fb33b34bf,True,,,Ambitions for Britain,51320_200106,51320_200106_59
Truancy and exclusion.,,,1168,51320_200106,51320,200106,english,MARPOR,False,True,False,8a16cb00ecf05f0ec40a7aa0ad337148,/down/originals/2021-1/51320_2001.pdf,deb3ffa297973eaac15e526fb33b34bf,True,,,Ambitions for Britain,51320_200106,51320_200106_59
Labour has a target of reducing truancy and exclusion by a third by 2002.,605,,1169,51320_200106,51320,200106,english,MARPOR,False,True,False,8a16cb00ecf05f0ec40a7aa0ad337148,/down/originals/2021-1/51320_2001.pdf,deb3ffa297973eaac15e526fb33b34bf,True,,,Ambitions for Britain,51320_200106,51320_200106_59
"The police are conducting truancy sweeps; parents are now subject to fines of up to £2,500; funds are being targeted towards pupils at risk.",605,,1170,51320_200106,51320,200106,english,MARPOR,False,True,False,8a16cb00ecf05f0ec40a7aa0ad337148,/down/originals/2021-1/51320_2001.pdf,deb3ffa297973eaac15e526fb33b34bf,True,,,Ambitions for Britain,51320_200106,51320_200106_59
16- to 18-year-olds.,,,1171,51320_200106,51320,200106,english,MARPOR,False,True,False,8a16cb00ecf05f0ec40a7aa0ad337148,/down/originals/2021-1/51320_2001.pdf,deb3ffa297973eaac15e526fb33b34bf,True,,,Ambitions for Britain,51320_200106,51320_200106_59
"Nearly ten per cent of 16- to 18-year-olds are not in education, training or work.",706,,1172,51320_200106,51320,200106,english,MARPOR,False,True,False,8a16cb00ecf05f0ec40a7aa0ad337148,/down/originals/2021-1/51320_2001.pdf,deb3ffa297973eaac15e526fb33b34bf,True,,,Ambitions for Britain,51320_200106,51320_200106_59
"The new Connexions service will bridge the gap, providing a single adviser to ensure all young people receive clear advice on the transition to work.",706,,1173,51320_200106,51320,200106,english,MARPOR,False,True,False,8a16cb00ecf05f0ec40a7aa0ad337148,/down/originals/2021-1/51320_2001.pdf,deb3ffa297973eaac15e526fb33b34bf,True,,,Ambitions for Britain,51320_200106,51320_200106_59
Neighbourhood renewal.,,,1174,51320_200106,51320,200106,english,MARPOR,False,True,False,8a16cb00ecf05f0ec40a7aa0ad337148,/down/originals/2021-1/51320_2001.pdf,deb3ffa297973eaac15e526fb33b34bf,True,,,Ambitions for Britain,51320_200106,51320_200106_59
